{
 "schema_version": 2,
 "kind": "skill_subgraph",
 "subgoal_id": "find_and_bin_the_can",
 "nodes": [
  {
   "id": "n1",
   "skill": "search",
   "args": {
    "object": {
     "ref": "the can"
    }
   },
   "depends_on": []
  },
  {
   "id": "n2",
   "skill": "navigate",
   "args": {
    "destination": {
     "from": "n1.found_on"
    }
   },
   "depends_on": [
    "n1"
   ]
  },
  {
   "id": "n3",
   "skill": "pick",
   "args": {
    "object": {
     "ref": "the can"
    }
   },
   "depends_on": [
    "n2"
   ]
  },
  {
   "id": "n4",
   "skill": "navigate",
   "args": {
    "destination": {
     "ref": "the trash can"
    }
   },
   "depends_on": [
    "n3"
   ]
  },
  {
   "id": "n5",
   "skill": "drop",
   "args": {
    "object": {
     "ref": "the can"
    },
    "container": {
     "ref": "the trash can"
    }
   },
   "depends_on": [
    "n4"
   ]
  }
 ]
}