{
 "schema_version": 2,
 "kind": "skill_subgraph",
 "subgoal_id": "square_block",
 "nodes": [
  {
   "id": "n1",
   "skill": "navigate",
   "args": {
    "destination": {
     "value": "kitchen_island/top"
    }
   },
   "depends_on": []
  },
  {
   "id": "n2",
   "skill": "square",
   "args": {
    "object": {
     "value": "wooden_block_a"
    }
   },
   "depends_on": [
    "n1"
   ]
  }
 ]
}
