{
 "schema_version": 2,
 "kind": "skill_subgraph",
 "subgoal_id": "throw_away_can",
 "nodes": [
  {
   "id": "n1",
   "skill": "navigate",
   "args": {
    "destination": {
     "value": "kitchen_island/top"
    }
   },
   "depends_on": []
  },
  {
   "id": "n2",
   "skill": "pick",
   "args": {
    "object": {
     "value": "soda_can"
    }
   },
   "depends_on": [
    "n1"
   ]
  },
  {
   "id": "n3",
   "skill": "navigate",
   "args": {
    "destination": {
     "value": "trash_can"
    }
   },
   "depends_on": [
    "n2"
   ]
  },
  {
   "id": "n4",
   "skill": "place",
   "args": {
    "object": {
     "value": "soda_can"
    },
    "receptacle": {
     "value": "trash_can"
    }
   },
   "depends_on": [
    "n3"
   ]
  }
 ]
}
