{
 "schema_version": 2,
 "kind": "skill_subgraph",
 "subgoal_id": "recycle_and_store",
 "nodes": [
  {
   "id": "n1",
   "skill": "navigate",
   "args": {
    "destination": {
     "value": "TVStandFactory_6305370_spawn_asset_6627927/surface_1"
    }
   },
   "depends_on": []
  },
  {
   "id": "n2",
   "skill": "pick",
   "args": {
    "object": {
     "value": "soda_can"
    }
   },
   "depends_on": [
    "n1"
   ]
  },
  {
   "id": "n3",
   "skill": "navigate",
   "args": {
    "destination": {
     "value": "SimpleBookcaseFactory_6105320_spawn_asset_9196243/surface_3"
    }
   },
   "depends_on": [
    "n2"
   ]
  },
  {
   "id": "n4",
   "skill": "place",
   "args": {
    "object": {
     "value": "soda_can"
    },
    "receptacle": {
     "value": "wide_storage_bin"
    }
   },
   "depends_on": [
    "n3"
   ]
  },
  {
   "id": "n5",
   "skill": "navigate",
   "args": {
    "destination": {
     "value": "TVStandFactory_6305370_spawn_asset_6627927/surface_1"
    }
   },
   "depends_on": [
    "n4"
   ]
  },
  {
   "id": "n6",
   "skill": "pick",
   "args": {
    "object": {
     "value": "snack_carton"
    }
   },
   "depends_on": [
    "n5"
   ]
  },
  {
   "id": "n7",
   "skill": "navigate",
   "args": {
    "destination": {
     "value": "SimpleBookcaseFactory_6105320_spawn_asset_9196243/surface_3"
    }
   },
   "depends_on": [
    "n6"
   ]
  },
  {
   "id": "n8",
   "skill": "place",
   "args": {
    "object": {
     "value": "snack_carton"
    },
    "receptacle": {
     "value": "wide_storage_bin"
    }
   },
   "depends_on": [
    "n7"
   ]
  },
  {
   "id": "n9",
   "skill": "navigate",
   "args": {
    "destination": {
     "value": "foam_cube"
    }
   },
   "depends_on": [
    "n8"
   ]
  },
  {
   "id": "n10",
   "skill": "pick",
   "args": {
    "object": {
     "value": "foam_cube"
    }
   },
   "depends_on": [
    "n9"
   ]
  },
  {
   "id": "n11",
   "skill": "navigate",
   "args": {
    "destination": {
     "value": "SimpleBookcaseFactory_6105320_spawn_asset_9196243/surface_3"
    }
   },
   "depends_on": [
    "n10"
   ]
  },
  {
   "id": "n12",
   "skill": "place",
   "args": {
    "object": {
     "value": "foam_cube"
    },
    "receptacle": {
     "value": "wide_storage_bin"
    }
   },
   "depends_on": [
    "n11"
   ]
  }
 ]
}
